"","cancer_study_id","name","description"
"135","stad_tcga","Stomach Adenocarcinoma (TCGA, Provisional)","TCGA Stomach Adenocarcinoma; raw data at the <A HREF=""https://tcga-data.nci.nih.gov/"">NCI</A>."
"136","stad_utokyo","Stomach Adenocarcinoma (U Tokyo, Nat Genet 2014)","Whole exome sequencing of 30 diffuse-type gastric adenocarcinoma samples from the University of Tokyo."
"137","stad_uhongkong","Stomach Adenocarcinoma (UHK, Nat Genet 2011)","Exome sequencing of 22 gastric cancer samples."
"138","tgct_tcga","Testicular Germ Cell Cancer (TCGA, Provisional)","TCGA Testicular Germ Cell Cancer; raw data at the <A HREF=""https://tcga-data.nci.nih.gov/"">NCI</A>."
"139","tet_nci_2014","Thymic Epithelial Tumors (NCI, Nat Genet 2014)","Whole exome sequencing of 28 thymic epithelial tumors."
"140","thym_tcga","Thymoma (TCGA, Provisional)","TCGA Thymoma; raw data at the <A HREF=""https://tcga-data.nci.nih.gov/"">NCI</A>."
"141","thca_tcga","Thyroid Carcinoma (TCGA, Provisional)","TCGA Thyroid Carcinoma; raw data at the <A HREF=""https://tcga-data.nci.nih.gov/"">NCI</A>."
"142","urcc_mskcc_2016","Unclassified Renal Cell Carcinoma (MSKCC 2016)","Molecular Analysis of Unclassified Renal Cell Carcinoma"
"143","ucs_jhu_2014","Uterine Carcinosarcoma (Johns Hopkins University, Nat Commun 2014)","Whole exome sequencing (WXS) of 22 uterine carcinosarcoma/uterine malignant mixed Mullerian (UCS) tumors. <A HREF=""http://www.nature.com/ncomms/2014/140919/ncomms6006/extref/ncomms6006-s1.pdf"">"
"144","ucs_tcga","Uterine Carcinosarcoma (TCGA, Provisional)","TCGA Uterine Carcinosarcoma; raw data at the <A HREF=""https://tcga-data.nci.nih.gov/"">NCI</A>."
"145","ucec_tcga_pub","Uterine Corpus Endometrial Carcinoma (TCGA, Nature 2013)","TCGA Uterine Corpus Endometrial Carcinoma, containing 373 samples; raw data at the <A HREF=""https://tcga-data.nci.nih.gov/docs/publications/ucec_2013/"">NCI</A>."
"146","ucec_tcga","Uterine Corpus Endometrial Carcinoma (TCGA, Provisional)","TCGA Uterine Corpus Endometrial Carcinoma; raw data at the <A HREF=""https://tcga-data.nci.nih.gov/"">NCI</A>."
"147","uvm_tcga","Uveal Melanoma (TCGA, Provisional)","TCGA Uveal Melanoma; raw data at the <A HREF=""https://tcga-data.nci.nih.gov/"">NCI</A>."
